<?xml version="1.0"?>
<xs:schema xmlns:xs="http://www.w3.org/2001/XMLSchema">

<?xml-stylesheet type="text/xsl" href="ex3.xsl"?>

<xs:element name="company">
    <xs:complexType>
        <xs:sequence>
            <xs:element name="info">
                <xs:complexType>
                    <xs:sequence>
                        <xs:element name="name" type="xs:string"/>
                        <xs:element name="founded">
                            <xs:complexType>
                                <xs:simpleContent>
                                    <xs:extension base="xs:string">
                                        <xs:attribute name="year">
                                            <xs:simpleType>
                                                <xs:restriction base="xs:integer">
                                                    <xs:minInclusive value="1800"/>
                                                    <xs:maxInclusive value="2026"/>
                                                </xs:restriction>
                                            </xs:simpleType>
                                        </xs:attribute>
                                    </xs:extension>
                                </xs:simpleContent>
                            </xs:complexType>
                        </xs:element>
                        <xs:element name="active" type="xs:boolean"></xs:element>
                    </xs:sequence>
                </xs:complexType>
            </xs:element>
            <xs:element name="departments">
                <xs:complexType>
                    <xs:sequence>
                        <xs:element name="department" maxOccurs="unbounded">
                            <xs:complexType>
                                <xs:sequence>
                                    <xs:element name="name" type="xs:string"/>
                                    <xs:element name="employees">
                                        <xs:complexType>
                                            <xs:sequence>
                                                <xs:element name="employee" maxOccurs="unbounded">
                                                    <xs:complexType>
                                                        <xs:sequence>
                                                            <xs:element name="name" type="xs:string"/>
                                                            <xs:element name="age">
                                                                <xs:simpleType>
                                                                    <xs:restriction base="xs:integer">
                                                                        <xs:minInclusive value="0"/>
                                                                        <xs:maxInclusive value="66"/>
                                                                    </xs:restriction>
                                                                </xs:simpleType>
                                                            </xs:element>
                                                            <xs:element name="salary">
                                                                <xs:complexType>
                                                                    <xs:simpleContent>
                                                                        <xs:extension base="xs:decimal">
                                                                            <xs:attribute name="currency">
                                                                                <xs:simpleType>
                                                                                    <xs:restriction base="xs:string">
                                                                                        <xs:enumeration value="EUR"/>
                                                                                        <xs:enumeration value="DOL"/>
                                                                                        <xs:enumeration value="REAL"/>
                                                                                    </xs:restriction>
                                                                                </xs:simpleType>
                                                                            </xs:attribute>
                                                                        </xs:extension>
                                                                    </xs:simpleContent>
                                                                </xs:complexType>
                                                            </xs:element>
                                                            <xs:element name="contact">
                                                                <xs:complexType>
                                                                    <xs:sequence>
                                                                        <xs:element name="email" type="xs:string"/>
                                                                        <xs:element name="phone" type="xs:string"/>
                                                                    </xs:sequence>
                                                                </xs:complexType>
                                                            </xs:element>
                                                            <xs:element name="skills">
                                                                <xs:complexType>
                                                                    <xs:sequence>
                                                                        <xs:element name="skill" maxOccurs="unbounded" type="xs:string"/>
                                                                    </xs:sequence>
                                                                </xs:complexType>
                                                            </xs:element>
                                                        </xs:sequence>
                                                        <xs:attribute name="id" type="xs:string"/>
                                                    </xs:complexType>
                                                </xs:element>
                                            </xs:sequence>
                                        </xs:complexType>
                                    </xs:element>
                                </xs:sequence>
                                <xs:attribute name="id" type="xs:string"/>
                                <xs:attribute name="type" type="xs:string"/>
                            </xs:complexType>
                        </xs:element>
                    </xs:sequence>
                </xs:complexType>
            </xs:element>
            <xs:element name="notes"/>
        </xs:sequence>
    </xs:complexType>
</xs:element>

</xs:schema>